{
  "jobId": "REQUIRED_JOB_ID",
  "commandId": "REQUIRED_COMMAND_ID",
  "projectId": "REQUIRED_PROJECT_ID",
  "status": "queued",
  "priority": "normal",
  "riskLevel": "R0",
  "commandType": "REQUIRED_COMMAND_TYPE",
  "requestedBy": "REQUIRED_OWNER_OR_APPROVER",
  "assignedDomain": "REQUIRED_OS_DOMAIN",
  "assignedAgent": "REQUIRED_AGENT_OR_SYSTEM",
  "approvalRequired": true,
  "approvalId": "REQUIRED_APPROVAL_ID_OR_NOT_REQUIRED",
  "blockedReason": "REQUIRED_IF_BLOCKED",
  "expectedOutput": "REQUIRED_EXPECTED_OUTPUT",
  "queueTimestamps": {
    "queuedAt": "REQUIRED_QUEUED_AT",
    "planningStartedAt": "REQUIRED_IF_STARTED",
    "runningStartedAt": "REQUIRED_IF_STARTED",
    "completedAt": "REQUIRED_IF_COMPLETED",
    "cancelledAt": "REQUIRED_IF_CANCELLED"
  },
  "safety": {
    "credentialsAllowed": false,
    "liveServicesAllowed": false,
    "deploymentAllowed": false,
    "domainChangeAllowed": false,
    "productionDataAllowed": false,
    "paidActionAllowed": false
  },
  "createdAt": "REQUIRED_CREATED_AT",
  "updatedAt": "REQUIRED_UPDATED_AT"
}
