{
  "jobId": "job-runtime-github-construction-website-repo-20260703",
  "commandId": "command-intake-runtime-github-construction-website-repo-20260703",
  "projectId": "project-unregistered-construction-website",
  "status": "done",
  "priority": "normal",
  "riskLevel": "R1",
  "commandType": "plan_only",
  "requestedBy": "owner-gurnoor-bassi",
  "assignedDomain": "command-os",
  "assignedAgent": "agent-local-runtime",
  "approvalRequired": false,
  "expectedOutput": "Plan-only command intake record for a construction website.",
  "queueTimestamps": {
    "queuedAt": "2026-07-03T20:45:00.000Z",
    "completedAt": "2026-07-03T20:45:00.000Z"
  },
  "safety": {
    "credentialsAllowed": false,
    "liveServicesAllowed": false,
    "deploymentAllowed": false,
    "domainChangeAllowed": false,
    "productionDataAllowed": false,
    "paidActionAllowed": false
  },
  "createdAt": "2026-07-03T20:45:00.000Z",
  "updatedAt": "2026-07-03T20:45:00.000Z"
}
